<mediawiki xmlns="http://www.mediawiki.org/xml/export-0.3/" xmlns:xsi="http://www.w3.org/2001/XMLSchema-instance" xsi:schemaLocation="http://www.mediawiki.org/xml/export-0.3/ http://www.mediawiki.org/xml/export-0.3.xsd" version="0.3" xml:lang="en">
<siteinfo>
  <sitename>DemoWiki</sitename>
  <base>http://example.com/wiki/Main_Page</base>
  <generator>MediaWiki 1.5.0</generator>
  <case>first-letter</case>
  <namespaces>
    <namespace key="-2">Media</namespace>
    <namespace key="-1">Special</namespace>
    <namespace key="0"></namespace>
    <namespace key="1">Talk</namespace>
    <namespace key="2">User</namespace>
    <namespace key="3">User talk</namespace>
    <namespace key="4">DemoWiki</namespace>
    <namespace key="5">DemoWIki talk</namespace>
    <namespace key="6">Image</namespace>
    <namespace key="7">Image talk</namespace>
    <namespace key="8">MediaWiki</namespace>
    <namespace key="9">MediaWiki talk</namespace>
    <namespace key="10">Template</namespace>
    <namespace key="11">Template talk</namespace>
    <namespace key="12">Help</namespace>
    <namespace key="13">Help talk</namespace>
    <namespace key="14">Category</namespace>
    <namespace key="15">Category talk</namespace>
  </namespaces>
</siteinfo>
<page>
  <title>First page</title>
  <id>1</id>
  <revision>
    <id>1</id>
    <timestamp>2001-01-15T12:00:00Z</timestamp>
    <contributor><ip>10.0.0.1</ip></contributor>
    <comment>page 1, rev 1</comment>
    <text>page 1, rev 1</text>
  </revision>
  <revision>
    <id>2</id>
    <timestamp>2001-01-15T12:00:00Z</timestamp>
    <contributor><ip>10.0.0.1</ip></contributor>
    <comment>page 1, rev 2</comment>
    <text>page 1, rev 2</text>
  </revision>
  <revision>
    <id>4</id>
    <timestamp>2001-01-15T12:00:00Z</timestamp>
    <contributor><ip>10.0.0.1</ip></contributor>
    <comment>page 1, rev 4</comment>
    <text>page 1, rev 4</text>
  </revision>
</page>
<page>
  <title>Second page</title>
  <id>2</id>
  <revision>
    <id>3</id>
    <timestamp>2001-01-15T12:00:00Z</timestamp>
    <contributor><ip>10.0.0.1</ip></contributor>
    <comment>page 2, rev 3</comment>
    <text>page 2, rev 3</text>
  </revision>
</page>
<page>
  <title>Third page</title>
  <id>3</id>
  <revision>
    <id>5</id>
    <timestamp>2001-01-15T12:00:00Z</timestamp>
    <contributor><ip>10.0.0.1</ip></contributor>
    <comment>page 3, rev 5</comment>
    <text>page 3, rev 5</text>
  </revision>
</page>
</mediawiki>
